"tweet_id","in_reply_to_status_id","in_reply_to_user_id","retweeted_status_id","retweeted_status_user_id","timestamp","source","text","expanded_urls"
"6380981316","6347458395","652193","","","2009-12-05 21:58:58 +0000","<a href=""http://itunes.apple.com/app/twitter/id333903271?mt=8"" rel=""nofollow"">Twitter for iPhone</a>","@parislemon @techcrunch Have you asked @fdacdrhindustry or @USDAgov or http://fdatransparencyblog.fda.gov/ instead of just slamming them?"
"6380014704","","","6379560882","82788404","2009-12-05 21:19:51 +0000","web","RT @expertlabs: We're loving the Red Balloons http://bit.ly/4FfXgS"
"6379255529","","","","","2009-12-05 20:49:24 +0000","<a href=""http://itunes.apple.com/app/twitter/id333903271?mt=8"" rel=""nofollow"">Twitter for iPhone</a>","It's wintry mixing here in NYC! Fun fact: New Yorkers have over 40 snowclones for ""wintry mix is the new snow""."
"6374419923","","","","","2009-12-05 17:30:26 +0000","<a href=""http://itunes.apple.com/app/twitter/id333903271?mt=8"" rel=""nofollow"">Twitter for iPhone</a>","That reminds me @gavinpurcell, I've been wanting to interview Andy Rooney for my blog for 10 years. Anybody have a contact at @cbsnews?"
"6350999926","","16204159","","","2009-12-04 22:14:52 +0000","<a href=""http://bit.ly"" rel=""nofollow"">bit.ly</a>","@harryallen please tell me you've seen this, the best newspaper correction ever: http://bit.ly/wp911joke (courtesy of @mike_ftw)"
"6349574028","","","","","2009-12-04 21:19:41 +0000","<a href=""http://itunes.apple.com/app/twitter/id333903271?mt=8"" rel=""nofollow"">Twitter for iPhone</a>","I like the idea of Startup Visas, but wouldn't it be easier to modify the existing Alien of Extraordinary Ability vs. creating a new type?"
"6348943134","","","","","2009-12-04 20:55:29 +0000","<a href=""http://bit.ly"" rel=""nofollow"">bit.ly</a>","A nice writeup by @werty about his site Timely Demise as it ends its run: http://bit.ly/tdemise"
"6344704222","","","","","2009-12-04 18:18:06 +0000","<a href=""http://itunes.apple.com/app/twitter/id333903271?mt=8"" rel=""nofollow"">Twitter for iPhone</a>","Why @sivers gave away his company CDBaby to charity: http://sivers.org/trust ""[T]he less I own, the happier I am."""
"6325963507","6325853530","1083791","","","2009-12-04 03:41:42 +0000","web","@jakedobkin Has leveled up from best Twitterer to perhaps Greatest Tweetist Ever thanks to @maxdobkin."
"6325485654","","","","","2009-12-04 03:23:27 +0000","<a href=""http://itunes.apple.com/app/twitter/id333903271?mt=8"" rel=""nofollow"">Twitter for iPhone</a>","Wish: A Mac browser in a 480x320 window that reports itself as Mobile Safari, has tabs, maps touchpad to nav. iPhone browser for desktop."
"6323613558","","","","","2009-12-04 02:14:39 +0000","<a href=""http://itunes.apple.com/app/twitter/id333903271?mt=8"" rel=""nofollow"">Twitter for iPhone</a>","Slightly more constructive @google advice: Make current TOS for DNS apply to 8.8.8.8 and use a new IP address if you change the TOS."
"6320609053","","20536157","","","2009-12-04 00:28:44 +0000","<a href=""http://itunes.apple.com/app/twitter/id333903271?mt=8"" rel=""nofollow"">Twitter for iPhone</a>","@google, you need a VP in charge of ""Does this make us seem creepy as hell?"" There is a real blind spot over there that's unfortunate."
"6316968437","","","","","2009-12-03 22:18:27 +0000","<a href=""http://twidroid.com"" rel=""nofollow"">twidroid</a>","RT @dansays Google cut off our AdWords account last night. We spend $1M+/year, and they say it'll take 3 days to reinstate. Can anyone help"
"6316062149","","","","","2009-12-03 21:46:03 +0000","<a href=""http://twidroid.com"" rel=""nofollow"">twidroid</a>","Just went by a huge eBay billboard getting on the 101 in SF, and it says ""Directions to saving money: Buy last year's model."" #lastyears"
"6314330743","","10990","","","2009-12-03 20:39:01 +0000","<a href=""http://twidroid.com"" rel=""nofollow"">twidroid</a>","@megnut RT @djacobs @megnut I recommend the jazz dentist."
"6309861268","","","","","2009-12-03 17:45:33 +0000","<a href=""http://itunes.apple.com/app/twitter/id333903271?mt=8"" rel=""nofollow"">Twitter for iPhone</a>","Wait, Comcast bought the Sheinhardt Wig company? This hurts my mindgrapes!"
"6289564437","","422","","","2009-12-03 02:04:18 +0000","<a href=""http://itunes.apple.com/app/twitter/id333903271?mt=8"" rel=""nofollow"">Twitter for iPhone</a>","@shellen just dodged a bullet. This is why you should check out @brizzly"
"6289454025","","","","","2009-12-03 02:00:42 +0000","<a href=""http://itunes.apple.com/app/twitter/id333903271?mt=8"" rel=""nofollow"">Twitter for iPhone</a>","I am at a conference and someone said my name! By omitted mentioning my URL. THIS SLIGHT SHALL NOT GO UNPUNISHED."
"6286314221","","","","","2009-12-03 00:13:02 +0000","<a href=""http://itunes.apple.com/app/twitter/id333903271?mt=8"" rel=""nofollow"">Twitter for iPhone</a>","A guy named David is asking a question at a tech conference, everybody take a drink!"
"6285884209","","","","","2009-12-02 23:58:21 +0000","<a href=""http://itunes.apple.com/app/twitter/id333903271?mt=8"" rel=""nofollow"">Twitter for iPhone</a>","I am at a conference, live tweeting! Here's what's going on: People are talking, and some people are listening. You are not here."
"6276403356","","","","","2009-12-02 18:10:07 +0000","<a href=""http://twidroid.com"" rel=""nofollow"">twidroid</a>","Oh San Francisco. It's almost 2010 and laptop-toting nerd boys are still dyeing their hair ""cyberpunk"" blue. #freekevinmitnick"
"6274691303","","","","","2009-12-02 17:04:58 +0000","<a href=""http://itunes.apple.com/app/twitter/id333903271?mt=8"" rel=""nofollow"">Twitter for iPhone</a>","Today's headlines, fixed: Cheney accuses President of treason in wimpiest way possible. Yahoo sells to Facebook for $0. Pro athletes cheat."
"6261794014","","","","","2009-12-02 06:08:56 +0000","<a href=""http://itunes.apple.com/app/twitter/id333903271?mt=8"" rel=""nofollow"">Twitter for iPhone</a>","Prediction: Thursday, February 18, 2010, Sade's ""Soldier of Love"" debuts as the last Billboard #1 album where physical CDs outsell digital."
"6249437687","","","","","2009-12-01 22:37:06 +0000","<a href=""http://itunes.apple.com/app/twitter/id333903271?mt=8"" rel=""nofollow"">Twitter for iPhone</a>","Congrats to the whole @square team! There's a great joke here about @square, @biz and Teena Marie, but it'd just confuse the white folks."
"6242957121","6241562074","4711","","","2009-12-01 18:37:29 +0000","<a href=""http://itunes.apple.com/app/twitter/id333903271?mt=8"" rel=""nofollow"">Twitter for iPhone</a>","@sippey @choire COVER YOUR ASSES - I'm on team @jkottke here."
